<?xml version="1.0" encoding="UTF-8"?>

<fastfood-database xsi:noNamespaceSchemaLocation="ffmapSchema.xsd" xmlns=""
   xmlns:xsi="http://www.w3.org/2001/XMLSchema-instance">
   <joint id="1" name="Vyhlídal">
       <location lat="32.2222" lon="45.55555">
           <adress>
               <city>Brno</city>
               <street>Sladkého</street>
               <street-number>9A</street-number>
           </adress>
       </location>
       <opening-hours>
           <mon>
                <open-span>
                    <start>08:00:00</start>
                    <end>23:30:00</end>
                </open-span>
           </mon>
           <tue>
                <open-span>
                    <start>08:00:00</start>
                    <end>23:30:00</end>
                </open-span>
           </tue>
           <wed>
                <open-span>
                    <start>08:00:00</start>
                    <end>23:30:00</end>
                </open-span>
           </wed>
           <thu>
                <open-span>
                    <start>08:00:00</start>
                    <end>23:30:00</end>
                </open-span>
           </thu>
           <fri>
                <open-span>
                    <start>08:00:00</start>
                    <end>23:30:00</end>
                </open-span>
           </fri>
           <sat>
                <open-span>
                    <start>08:00:00</start>
                    <end>23:30:00</end>
                </open-span>
           </sat>
           <sun>
                <open-span>
                    <start>08:00:00</start>
                    <end>23:30:00</end>
                </open-span>
           </sun>
       </opening-hours>
       <menu>
           <menu-item>
               <product-ref>1</product-ref>
               <price>10.00</price>
           </menu-item>
           <menu-item>
               <product-ref>3</product-ref>
               <price>27.00</price>
           </menu-item>
       </menu>
       <tags>
           <tag>Kentus</tag>
       </tags>
       <comments/>
       <web-page>http://www.stash.wz.cz</web-page>
   </joint>
</fastfood-database>
